{"apiVersion":"modos.pleiades/v1alpha1","authority":{"authorizationApplied":false,"ceiling":"none","executionApplied":false,"registryMutationApplied":false,"trustEvaluationOnly":true},"blockedInputs":[],"candidateDigest":"sha256:63f923727ca0ab01a2ab4b07232c45e94097d5b3628bedd69d1914e5f31889f3","candidateId":"operator-input-candidate:synthetic-ready-0001","checks":[{"name":"registry-closure","status":"pass"},{"name":"candidate-binding","status":"pass"},{"name":"issuer-scope","status":"pass"},{"name":"key-integrity","status":"pass"},{"name":"signature-verification","status":"pass"},{"name":"freshness","status":"pass"},{"name":"revocation","status":"pass"},{"name":"attestation-completeness","status":"pass"}],"evaluatedAt":"2026-07-20T23:30:00Z","kind":"OperatorEvidenceTrustReceipt","receiptDigest":"sha256:be064effd41274e9cb24987c1793ca0c559ac74d244103f16914740db0c59b48","registryDigest":"sha256:af430b6ff1baacbb423f1773221e0148fdac8512db75d6d530ead65956f3ac60","registryId":"operational-authority:synthetic-v1","requiredInputCount":8,"state":"trusted","trustedInputCount":8,"trustedInputs":[{"ageSeconds":1500,"attestationId":"attestation:synthetic:authorityGrant:v1","expiresAt":"2026-07-21T23:05:00Z","inputId":"authorityGrant","issuedAt":"2026-07-20T23:05:00Z","issuerRef":"human:synthetic-steward","keyRef":"key:synthetic-steward-v1","statementDigest":"sha256:96b16c356913e6defa931906e497c8393415192db922e3854478a11bd24107be","status":"trusted"},{"ageSeconds":600,"attestationId":"attestation:synthetic:canaryPlan:v1","expiresAt":"2026-07-21T00:20:00Z","inputId":"canaryPlan","issuedAt":"2026-07-20T23:20:00Z","issuerRef":"service:synthetic-live-evidence","keyRef":"key:synthetic-live-evidence-v1","statementDigest":"sha256:839e162b4b0407479f22d30f2d0205e42a5a78e45b1d4f6118244e7e17c6e845","status":"trusted"},{"ageSeconds":1500,"attestationId":"attestation:synthetic:historyDecision:v1","expiresAt":"2026-07-21T23:05:00Z","inputId":"historyDecision","issuedAt":"2026-07-20T23:05:00Z","issuerRef":"human:synthetic-steward","keyRef":"key:synthetic-steward-v1","statementDigest":"sha256:c9e497252597d78cc1625557f83bd83842e17da69df0ecb9bfe24ca33808e317","status":"trusted"},{"ageSeconds":600,"attestationId":"attestation:synthetic:nodeInventory:v1","expiresAt":"2026-07-21T00:20:00Z","inputId":"nodeInventory","issuedAt":"2026-07-20T23:20:00Z","issuerRef":"service:synthetic-live-evidence","keyRef":"key:synthetic-live-evidence-v1","statementDigest":"sha256:72fbdb4b48cb9e5c96717dfd4f00ced5e9e2fa4300e48516157b6826560138db","status":"trusted"},{"ageSeconds":600,"attestationId":"attestation:synthetic:observationPlan:v1","expiresAt":"2026-07-21T00:20:00Z","inputId":"observationPlan","issuedAt":"2026-07-20T23:20:00Z","issuerRef":"service:synthetic-live-evidence","keyRef":"key:synthetic-live-evidence-v1","statementDigest":"sha256:a30aaa2c291d62b571aa2ea749fbf9ca12cec8dc602c1f1df6b2dc6f2e773bb4","status":"trusted"},{"ageSeconds":1200,"attestationId":"attestation:synthetic:observedInventory:v1","expiresAt":"2026-07-21T23:10:00Z","inputId":"observedInventory","issuedAt":"2026-07-20T23:10:00Z","issuerRef":"service:synthetic-private-evidence","keyRef":"key:synthetic-private-evidence-v1","statementDigest":"sha256:411a209a6df8f1f1657d48729627b0624f204cf59e554fb5bba087e4d462674d","status":"trusted"},{"ageSeconds":1200,"attestationId":"attestation:synthetic:privateEcology:v1","expiresAt":"2026-07-21T23:10:00Z","inputId":"privateEcology","issuedAt":"2026-07-20T23:10:00Z","issuerRef":"service:synthetic-private-evidence","keyRef":"key:synthetic-private-evidence-v1","statementDigest":"sha256:996c849f50a6141a548c34cdab5fa978326a6d4c59702afc9be5a3bfd0aaa77c","status":"trusted"},{"ageSeconds":1500,"attestationId":"attestation:synthetic:signingIdentity:v1","expiresAt":"2026-07-21T23:05:00Z","inputId":"signingIdentity","issuedAt":"2026-07-20T23:05:00Z","issuerRef":"human:synthetic-steward","keyRef":"key:synthetic-steward-v1","statementDigest":"sha256:d6b2d38ef24cc0c9127acdb151d63f4c06a2ecfeaa33680eaaccdf0fe21a1c7b","status":"trusted"}]}
